{
  "phase": "REVIEW",
  "outcome": "pass",
  "summary": "Read-only review одобрил изменение без blockers/warnings. Проверены validation API, канонический порядок, отсутствие скрытого store.notes в request path, zero-read semantics для profile/task_state/memory, finally-cleanup request snapshot, сохранение pause/done guards при включённой FSM, явный plain-chat режим при task_state=false, совместимость Runtime --recent-turns и все внутренние Agent constructors. Отключение контекста не мутирует SQLite. Scope machine чист; секретов, сети и внешних side effects нет. Реальный provider обоснованно не запускался, поскольку проверяемая граница — детерминированный payload builder.",
  "artifacts": {
    "review_report": "experiments/context-modularization-machine/runs/04-review-report.md"
  },
  "checks": {
    "independent_review": true
  },
  "violations": [],
  "blockers": [],
  "next_action": "Перевести контракт в DONE; следующим отдельным task-contract создать полуавтономный agent loop поверх завершённой модульной сборки."
}
