{
  "phase": "VALIDATION",
  "outcome": "pass",
  "summary": "В независимой scratch-копии без исправления day13 прошли py_compile, 10 task-state/context сценариев, 5 web сценариев и 4 группы live-eval unit tests. Characterization подтверждает default profile+FSM+3 memory layers+6 turns; selective case включает только short+long в каноническом порядке; spy-store фиксирует ноль вызовов load_profile/load_notes/load_task_state при полном отключении; повторное открытие store подтверждает сохранность данных; mutation-during-build подтверждает один immutable capabilities snapshot и один FSM read. Scope check не обнаружил protected или unexpected changes. Сеть не использовалась.",
  "artifacts": {
    "test_report": "experiments/context-modularization-machine/runs/02-validation-report.md"
  },
  "checks": {
    "offline_tests": true,
    "default_compatibility": true,
    "selective_loading": true,
    "non_destructive_disable": true,
    "request_snapshot": true
  },
  "violations": [],
  "blockers": [],
  "next_action": "Перейти в LIVE_VALIDATION и выполнить отдельный локальный runtime/fake-client прогон матрицы фактически отправленных messages без сети."
}
