{
  "phase": "REVIEW",
  "outcome": "pass",
  "summary": "Read-only review одобрил реализацию без blockers и warnings. Проверены preflight до сети, единый snapshot, response guard до append_turn, остановка workflow до proposal, параметризованный SQL, textContent в UI, task-scope, migration и отсутствие chain-of-thought в audit. Ограниченность regex-политики честно документирована как граница MVP, а не скрыта за заявлением о полном semantic enforcement.",
  "artifacts": {"review_report": "day14/results/review-report.md"},
  "checks": {"independent_review": true},
  "violations": [],
  "blockers": [],
  "next_action": "Перевести Codex FSM в DONE и обновить краткий проектный статус."
}
