{
  "phase": "REVIEW",
  "outcome": "pass",
  "summary": "Финальный read-only review одобрил release-код без blockers и warnings. Проверены request preflight до model call, единый invariant snapshot в context и response guard, блокировка raw output до persistence, workflow stop до proposal, task scope и structured policy persistence. Adversarial matrix различает 12 конфликтов, 6 безопасных explanations, 9 запрещённых outputs и explicit approval; отрицание подтверждение не нужно не обходит business rule. Ограничение text policy и production-переход к typed tool boundary явно документированы.",
  "artifacts": {"review_report": "day14/results/review-report.md"},
  "checks": {"independent_review": true},
  "violations": [],
  "blockers": [],
  "next_action": "Перевести Codex FSM в DONE и обновить краткий проектный статус."
}
